[
  {
    "id": "bt_62be5e99",
    "strategy_id": "macd趋势",
    "params": {
      "fast": 12,
      "slow": 26,
      "signal": 9
    },
    "codes": [
      "000001.SZ"
    ],
    "start_date": "2023-01-01",
    "end_date": "2024-12-31",
    "config": {
      "initial_cash": 100000,
      "commission": 0.00025,
      "size": 0.2
    },
    "summary": {
      "total_return": 0.0,
      "total_trades": 19,
      "win_rate": 0.2632,
      "profit_factor": 0.99,
      "stocks_tested": 1,
      "stocks_success": 1
    },
    "created_at": "2026-08-14T02:42:35.733732+00:00"
  },
  {
    "id": "bt_b1349850",
    "strategy_id": "rsi反转",
    "params": {
      "period": 14,
      "oversold": 30,
      "overbought": 70
    },
    "codes": [
      "000001.SZ"
    ],
    "start_date": "2023-01-01",
    "end_date": "2024-12-31",
    "config": {
      "initial_cash": 100000,
      "commission": 0.00025,
      "size": 0.2
    },
    "summary": {
      "total_return": 0.0,
      "total_trades": 6,
      "win_rate": 0.6667,
      "profit_factor": 0.76,
      "stocks_tested": 1,
      "stocks_success": 1
    },
    "created_at": "2026-08-14T02:42:17.700212+00:00"
  }
]